5173,"Currently it is possible to do it using Winium but not possible to do using WinAppDriver.",0
5174,"The File Explorer in Device Portal lets you look at .dat files (the ones where LocalSettings and RoamedSettings are stored) but there's no way to edit them.",0
5176,"SSML is not fully supported.",0
5180,"Our users occasionally experience freezes in our current high data volume C# .Net app that I believe is because of garbage collection.",0
5181,"Having to move to C++ for this would mean a drop in productivity for our developers.",0
5182,"Should show temperature data on device portal.",1
5185,"User can't be expected to keep the window maximized.",0
5186,"This makes sense for phones and tablet mode but for desktop and dedicated use devices it's just a limitation.",0
5187,"IoT supports a single app so it isn't affected but Windows 10 Mobile is.",0
5192,"Issues like this make it hard to use UWP in business use cases.",0
5195,"If UWP is to take over for Win32 this is basic requirement.",0
5199,"We're trying to build a solution based on Windows Mobile that runs a single Assigned Access app.",0
5201,"I can use Fiddler on my desktop to view my network traffic.",0
5203,"I run the converter on powershell but it can not finish the work though it doesn't report any problems.",0
5204,"In other works it keeps running state here is the complete log:",0
5206,"Attempting to choose the most recent one compatible with your version",0
5207,"We have several Instruments that implement an API via SOAP on Linux that presents as a WCF service.",0
5208,"Unfortunately we can't create UWP apps because there is no support for the custom WCF binding - which is needed - to talk to these instruments.",1
5209,"I'd love to do it!",0
5211,"Centennial: cmd line arguments...",0
5212,"Appx shortcuts do not support command line arguments.",0
5215,"Not sure if this is the right place but it seems that the makeAppx Commando doesn't like '.rels'-xml Files as added by the VS15 Setup.",0
5216,"I ran it multiple times yout to find the reason but it crashed with this Errors every time when it got to a '.rels' - File:",0
5233,"Just like an user have right for review so should developers be able to RESPOND TO EACH AND EVERY REVIEWS submitted to the Store.",1
5234,"If an user plans to opt out from a response from developer DO NOT EMAIL THE USER A RESPONSE but STILL ALLOW A RESPONSE TO MADE PUBLICLY VISIBLE.",1
5235,"Needless to say why because the current implementation is being exploited to submit false reviews and not allowing the developers to respond.",0
5236,"Since Application insights for mobile is discontinued soon the dev center analytics will be broken.",0
5237,"Actually exceptions thrown by UWP APIs are just painfully awful.",0
5239,"Too many empty StackTraces too many An error as occurred too many approximative and vague exceptions.",0
5240,"I understand that the unnecessary JavaScript made WinRT insanely complex to design... but please...",0
5241,"Exceptions are there for a reason... Not to just be an error has occurred message.",0
5247,"There is a Cordova plugin with Admob for Windows Phone 8 but there is still no plugin AdControl and specific Mediation to Cordova.",0
5248,"Admob does not release Windows Phone 10 support and has no roadmap to do it.",0
5249,"Smaato has already supported W10 but there are not plugin developed yet.",0
5251,"This will help us bring our apps to Windows Phone and Windows Universal platform.",0
5252,"System.Diagnostics.Process.Start(path); with path pointing to a folder or a html file or a txt file etc results in",0
5256,"The only solution found was to use StartInfo with explorer.exe for FileName and path for Arguments.",0
5259,"Soemthing gone wrong in one of the latest builds (currently I'm workong on 14322.1000) and after picking a file or folder the app crashes.",0
5260,"Sometimes it returns for a second but remains inresponsive.",0
5261,"Evertying seemed to work just right few builds before now many users report me problems.",0
5265,"While debugging if you click suspend the app and VS will hang and after a while your phone will likely restart.",0
5274,"Today there is a handler for NewWindowRequested to create new window but there seems to be no way to handle window.close() call from javascript for example.",0
5277,"UWP single-page app with WebView as only control.",0
5279,"When App is activated WebView control gets focus (and receives corresponding event) but the content of the WebView (eg HTML) does NOT get a focus and document.hasFocus() remains false.",0
5280,"If user clicks on the HTML document.hasFocus() becomes true and WebView receives LostFocus event(!)",0
5281,"Expected behaviour: WebView focus is in sync with document.hasFocus()",0
5283,"It seems to me that the Base-Image runs some sort of FirstRun-Setup everytime a Centennial installation is executed.",0
5285,"Wouldn't it be better to Call this Firstrun-Setup once and apply it to the base setup?",1
5289,"Give us a Print() function for the UWP WebView control.",1
5291,"Problems :1) MediaPlayer class play audio will delay 1-2s.",0
5293,"2) Audio file length less than 1 or 2 s will not playing.",0
5295,"So i did some research I decompile one of those app and found it used MediaPlayer class for playing audio filethen I wrote a demo and the same problem did occur.",0
5296,"But I don't have enough evidence to prove that.",0
5297,"It will be great appreciated that anyone see this will help me vote it up so Microsoft can aware and fix itit is really important for those who learning English and looking up vocabularies frequently in daily life.",0
5298,"Thank you very much.",0
5308,"I currently use the CodedUI testing framework as it allows me to logon to IE as a different user/password.",0
5309,"The sites that we test use Windows Authentication and ASP.NET Impersonation as they run on an intranet.",0
5310,"We do not use Basic authentication so cannot pass credentials on the url.",0
5313,"This means that we are forces to use the CodedUI framework.",0
5322,"Windows app store categories has tremendous potential to interact and request.",0
5338,"Scenario: we have a red that's an integral part of our identity.",0
5339,"Our users are asking for transparent tiles (including primary tile).",0
5341,"This leaves us in a bad place where we have to either sacrifice our branding or don't provide the required functionality",0
5342,"Proposed solution: have an independent color setting for Store-specific branding",1
5343,"Currently didn't support unicode.",0
5344,"I made a simple test code using KOREAN language.",0
5345,"And exception is raised.",0
5351,"If we look at .appx/the new installation mechanism as a much saner version of app installation then the more applications it allows the better.",0
5353,"My example: An interactive screen sharing app.",0
5355,"As far as I know this wouldn't be possible with Centennial as it exists today but these kinds of apps are still valuable.",0
5359,"Centennial takes big steps towards that but I'd like to go even further.",0
5363,"Not just 12 months.",0
5368,"I have a Style targeting a FontIcon control with a Setter for the FontFamily.",0
5376,"The open source platform IONIC has such a market place and I think it's great !",0
5382,"There exist a couple of UWP libraries  but their purpose is not to show beautifully designed apps implementing the material design principles of the framework.",0
5388,"As of now UIElement.Clip accepts only RectangleGeometry in UWP applications.",0
5392,"When UWP app has a Splash Screen with transparent background color declared in the app manifest desktop renders the accent color while phone renders the background color.",0
5395,"I belongs to India and want to register my self in Microsoft developer.",0
5396,"I need to pay life time registration fee for this.",0
5397,"when try to pay my fee there is only one option to make payment which is Credit Card.",0
5398,"No more options are there.",0
5399,"I do not have Credit Card therefore unable to make payment.",0
5401,"I have all these things but does not have only Credit Card and cause of only this minor reason I am unable to make payment.",0
5414,"When games get released on Steam Valve promotes the game for free by displaying it to 1 mln users.",0
5416,"Earlier there was option to cumulative download of all the app and now there is now way I can see total number of app downloads till date.",0
5418,"A report specially to know how many users have updated to a specific version of the App?",0
5421,"On some of my computers I only need the tools for phone deployment such as WinAppDeployCmd.",0
5423,"I don't code on all these machines I only need the tools!",0
5424,"I copied the tools out separately and they are only 106MB.",0
5425,"They work fine without the headers and libraries installed.",0
5436,"This feature is really usefull in messaging apps.",0
5440,"Is it the right place to report bugs to Microsoft?",0
5441,"Why do we need to call bug reports New Ideas?",0
5444,"(Administrator: I am listing this one as a bug because I consider it a existing security issue that can be exploited at present but please feel free to categorize it however you see fit as always!)",0
5448,"Therefore malicious parties could use any URL/location they would like under their control for the WebAuthenticationBroker.Authenticate* calls to phish the credentials of users of this process as users do not see/understand the URL in which the process is loading the content for the authentication workflow and therefore cannot validate its authenticity.",0
5450,"For context here are the steps (as I understand them) that can be used to exploit this process:",0
5460,"That is where your creativity comes in!",0
5465,"If it works pass the user on to the real sign in page (or better yet simply set cookies on the user's session that makes it seem all is OK).",1
5467,"9) Rule planet Earth with your new-found powers (OK I made this one up :) )",0
5468,"For reference this is based on a thread started in the MSDN forums which you can see here for additional information:",0
5470,"Thank you for any consideration!",0
5476,"Adding developer revenue or IAP price info to response will allow developers to receive accurate data about their income in requested period.",1
5487,"So I can get the SID or the groups of the user.",0
5488,"Most companies want to control the access of the user by the active directory.",0
5489,"The enterprise application uses this information whether a user got access or not.",0
5491,"Please help us out!",0
5493,"We are an ISV who live in out of the United States.",0
5494,"When we want to set app price Dev Center offers by US Dolloar for base price.",0
5495,"(Previous version of dev center was able to set by local currency.",0
5496,"This is degraded.)",0
5497,"USD is not familiar for us.",0
5498,"(We use different local currency basically.)",0
5499,"There is no conversion list between USD and local currency.",0
5500,"Microsoft sometimes changes conversion rate due to foreign exchange conversion rate.",0
5501,"Because of this it is hard to find expected price by our local currency.",0
5504,"Conversion rate seems not constant because of this it is hard to find our expected price.",0
5525,"I have certificate in user storage and app storage with same issuer and subject but with different EKU fields.",0
5526,"Certificate in user storage is filtered out and that's the one I'm interested in.",0
5527,"I need to check if it's installed already or not and function checking it returned false because of this and I ended up installing new one every time.",0
5528,"And none of those duplicates are listed.",0
5532,"Today the UI designer could not work because it cannot parse the node.",0
5545,"Currently the rates/reviews user submitted in Win10 Insider Preview will be disabled later.",0
5546,"And if devs respond to that reviews it will also be deleted.",0
5547,"This is ridiculous behavior for both users and devs.",0
5548,"If MS will disable rates/reviews sent from Win10 IP disallow users to rate/review.",0
5549," Improvements to Windows Store apps and games visibility",0
5551,"Currently it is not possible to export the app download statistics automatically via an API in the Windows dev center.",0
5555,"Currently Microsoft doesn't have any specific support for beacons.",0
5556,"Beacons are the next generation rulers in the market.",0
5557,"As a windows developer I don't see a good future for windows here",0
5558,"When ever I contact any manufacturer of beacons they basically hesitate to support windows because the limitation in the windows featurest.",0
5559,"We don;t have any separate library for beacons.",0
5560,"Beacon also considered as normal bluetooth device.",0
5561,"Currently I can only read (that too has many limitations)  I can't communicate.",0
5562,"This is a big drawback.",0
5563,"We expected this will be solved in windows 10  but not yet.",0
5564,"Till now many clients for my company left out windows and they moved to iOS and Android.",0
5565,"If this is going to continue then windows will face huge drawback.",0
5566,"I have raised many questions related to this in community forum.",0
5567,"There was no input from there.",0
5568,"I'm not sure you guys will have a look on this quickly or not.",0
5569,"Even if you have a look I'm not sure about your priority.",0
5570,"Windows wings are currently cut down in this area.",0
5583,"In WPF you can use textures and patterns for your app background with the TileBrush class.",0
5584,"Since ImageBrush inherits from TileBrush there is a missed property: Tile.",0
5587,"In windows forms it is easy to have users print without a dialog and to code the printer output to use a specific paper bin.",0
5588,"This functionality is missing in UWP.",0
5589,"One of our applications has users print checks from a shared check printer with the check stock in tray 4.",0
5590,"700+ users as 52 sites do this and it has worked fine in VB6 for the last 16 years.",0
5591,"Now that we want to upgrade the applications to a modern environment we find that UWP does not do it and WPF makes it hard leaving only Winforms.",0
5592,"Right now you can not register them forever.",0
5594,"For example the PRO extension stands usually for a better version of the same app from the SAME DEVELOPER.",0
5595,"But if someone else uses this it is misleading.",0
5613,"I am working in multinational company",0
5616,"It is always the accent color and cannot be changed.",0
5619,"Currently the Windows Blog commenting system suffers from a myriad of problems:",0
5625,"Conversely with Disqus you get the following benefits:",0
5631,"A blog post has been created to discuss these issues at length and you can read that here:",0
5634,"Thank you for any consideration and dialogue around this idea!",0
5644,"This is ridiculous.",0
5645,"Also and perhaps more importantly developers need this!",0
5646,"Do you know how many hoops I have to jump though to make an app that simply takes photos and puts them on a network location... Too many.",0
5649,"It is crazy that such basic functionality is not currently supported almost every device on the planet supports this other than windows phone.",0
5650,"What makes this even more important is the fact that it IS already supported in UWP apps when they are running on desktop laptops and tablets.",0
5651,"But the same file picker on phone is just missing this Universal functionality...",0
5661,"I am having difficulty testing an In App Purchase that is successful with Microsoft's servers yet somehow my app never receives that success message.",0
5663,"We have made a private test app and we use real money to test IAP.",0
5664,"This makes it hard to test when there is a $ cost to every test we perform.",0
5665,"I would prefer to be able to test IAP hundreds of times without having to attempt to get a refund for thousands of dollars.",1
5666,"This is currently not possible to test using CurrentAppSimulator.",0
5667,"Apple and Google also provide such a sandbox environment where IAP does not cost real money.",0
5677,"I have a parent application that stores files within app space.",0
5678,"Now when I wish to open a file the launcher asks me to choose a target application.",0
5681,"MyApp has a file 'Abc.pdf'.",0
5682,"On opening the file Abc.pdf from MyApp the launcher provides a list of applications that can open this file.",0
5683,"Assuming i choose PDF Reader I want MyApp to know when PDF Reader has closed or stopped accessing my file i.e Abc.pdf",0
5687,"Code analysis will often warn if you expose a properlty as a uri using a string type (can be ignored but CA is giving a fair warning here I feel).",0
5689,"I would like to see System.Uri supported natively by the runtime when making a binding like this.",1
5690,"Also as a side note - the conversion from string breaks (throws an exception) if a bound string is null or empty - however a string that is non-empty and NOT a valid uri doesn't throw.",0
5698,"However if you have a PIN on your system it treats that as a biometric device as well.",0
5699,"This is not what the documentation indicates.",0
5700,"UserConsentVerifier should not treat a PIN as a biometric device.",1
5702,"Right now when displaying online web page in Windows 10 WebView the HSTS security feature is not working.",0
5703,"Also the WebView allows scripts from any source to load even though the page is loaded via HTTPS.",0
5706,"See these pages for testing HSTS and mixed content:",0
5713,"I need support for ios the actual app has a lot of problems",0
5716,"More like angularJs style.",0
5718,"The old one is to verbose.",0
5721,"Unfortunately the glyph activity is never displayed on the tile.",0
5722,"But when I'm using any other glyph (such as alarm alert attention) it is properly displayed.",0
5727,"Thanks and best regards",0
5729,"We are migrating an application from Windows 8.1 to Windows 10.",0
5730,"The first problem that we encountred is that in WinRT enables to add an Service Reference of WCF and in UWP is not yet implemented.",0
5731,"Currently it's a mixture of some taxes are collected by MS some have to get paid by the developer.",0
5732,"As a smaller business this is a huge effort and only theoretically possible.",0
5734,"As far as I am informed the competition (Apple App Store Google Play) does this aswell.",0
5735,"Also MS used to collect more taxes than nowadays.",0
5736,"Look at this old feature request quoting an older Developer Agreement:",0
5740,"It states any current member country of the European Union which includes e.g.",0
5742,"Nowadays (Jan 13th 2016) the Dev Agreements lists Austria as a country which the developer has to collect the taxes:",0
5744,"Austria | Price being selected is the final sale price and includes any applicable taxes.",0
5757,"I need it to keep the app title bar background is the same with accent color.",0
5758,"On Windows 10 Mobile for mobile connections calling getSignalBars on a mobile connection always returns 5 even if the bars displayed by the system are any other value.",0
5759,"It's working on Wifi connection and on both type of connections on Windows 8.1.",0
5760,"Is this a bug or something changed in W10M ?",0
5761,"MAXPATH is giving me a severe headache lately!",0
5762,"I've been trying to compile some stuff and the compiler is necessarily creating processes with enormous arguments.",0
5763,"Everything would be fine but MAXPATH is too short to let it succeed!",0
5764,"This is the only reason I've got to switch to linux as I'm not in a position to change MAXPATH or rewrite the way the compiler calls processes.",0
5765,"PLEASE MICROSOFT HELP!",0
5770,"The generated bindings code is very large and not easy to follow.",0
5771,"Further it doesn't even exist until compilation and even then isn't visible to the user in VS.",0
5773,"Need timeout on read from StreamSocket just like with old .net sockets and serialport.",1
5774,"Now you have destroy the complete connection if a device on a Bluetooth serial connection does not respond.",0
5775,"While this makes no sense at all.",0
5776,"there nothing wrong with the connection it is just a serial device not responding.",0
5777,"Javascript provides a History API with which you can manipulation certain aspects of the browsing history.",0
5778,"For example history.replaceState() replaces the url of the current website in the browsing history.",0
5779,"However it is not possible to detect these changes in WebView without injecting javascript to replace the funtion calls.",0
5780,"This solution is quite hacky and a lot of work",0
5781,"About 90% of my apps can not be found in the store.",0
5782,"I have about 40 apps and around 8 are visible.",0
5783,"Even if I click on the developer name it still does not show all my apps.",0
5784,"If i do a deep link then yes it find the apps and you can download them but it wont find them with keywords or App Name.",0
5785,"This is the same issue for all Windows Stores.",0
5787,"Every version of Windows does not show my apps.",0
5788,"I actually had one of my apps appear and then disappear a day later.",0
5789,"This is unacceptable and is a strong deterrent to creating apps for Windows.",0
5795,"Phone 8.1 Phone 10 Windows 8 8.1 and Windows 10.",0
5800,"In-browser deployment was an excellent feature of Silverlight.",0
5801,"While most organizations will allow in-store apps it's still going to be very inconvenient to deploy apps through the app store for many reasons.",0
5802,"Firstly deployment in the app store requires rigorous testing etc. from Microsoft when the app users won't even be the general public.",0
5805,"Secondly we have many versions of the same application deployed to different customers.",0
5817,"Read email access Locally is very important to create professional and amazing apps for UWP apps, please allow us to achieve this!",1
5821,"We need set it in codes.",0
5825,"http request includes get or post request(url and body)",0
5826,"While android and ios can do it.",0
5830,"After changing to fullscreen and back the position of the window is wrong and not to influence right?",0
5833,"I just found that reading the property of System.Comment from a file doesn't work on Windows 10.",0
5834,"I used StorageFile.Properties.GetDocumentPropertiesAsync() to read the properties of a file that has Comment but DocumentProperties.Comment is a empty string.",0
5835,"Same problem happens to windows explorer set a new comment then apply to the file but when you read again there's nothing!",0
5838,"Currently Windows OS decides the best Internet connection and uses it automatically (If I have more than one connection like WiFi and Network cable).",0
5842,"UWP still lags all features of regular ADO to connect to any DB.",0
5843,"Using EF6/7 will only provide direct access to SqlLite and not regular DBs.",0
5844,"MS shall change EF7 to allow DB connectivity via batch data return like 50/100 return records at a time instead of SELECT * returning entire DB-Table data in one shot.",1
5846,"It appears there is a Enter File Name even when selecting an existing file using FileSavePicker on UWP mobile.",0
5847,"It seems to work as expected on desktop.",0
5848,"You can see my original question on MSDN forum below.",0
5852,"Winjs was designed prior to ES6.",0
5853,"Some of the capabilities are now provided by ES6 such as classses would not have to be provided by winjs.",0
5855,"Edge Browser VS 2015 and VS Code already provides support for ES6.",0
5859,"Unfortunately it is also bug-infested and lacks fundamental features expected from a graphical debugging tool in 2015.",0
5867,"The solution is open-sourcing WinDbg and related tools (dbghlp WinDbg extensions etc. ) which will allow the community to fix and improve what the rather small team at Microsoft doesn't manage to.",1
5880,"At the moment it is impractical for me as a developer to keep asking my boss for his Microsoft account just to create app packages.",0
5882,"I have posted my 1st application on windows store with 9 keywords.",0
5890,"For eg in publisher name or in application name whole word partial word and so on.",0
5905,"The App knows that it is a totaly new/clear situation",0
5909,"scenario: user save a file app is closed directory is deleted/renamed next time: Dlg Save file:",0
5922,"Currently it's difficult to do some of these things.",0
5923,"Nesting UIContainers inside of a RichTextBlock to add border elements needed for this ruins the alignment of text.",0
5926,"Inexplicably the UWP does not include the WPF WrapPanel that was introduced nearly 10 years ago.",0
5928,"There are other panels in the UWP that do something similar like the WrapGrid but this doesnt work well if the items are variable size.",0
5930,"One simple example where the WrapPanel is essential is when displaying a “tag cloud”.",0
5940,"There appears to be no way to deploy an app to a Windows 10 Emulator outside of manually doing so in Visual Studio.",0
5943,"Without that we have no means to wrap our own tooling to launch and install built apps to the emulator.",0
5945,"Oddly with Windows 8.1 tooling installed and Windows 10 SDK we can actually see the list of Windows 10 emulators listed in the AppDeployCmd output (and need to do some post-filtering to separate the 8.1 and 10 emulators).",0
5946,"So currently we can use the 8.1 tooling to get the list of emulators but if we try to deploy to them they'll start up but app deployment will fail.",0
5958,"Today I opened the Windows Dev account Payout report  I found up my advertising and my purchased app already separate into two?",0
5959,"Why this happen?",0
5961,"I developed the app bizview a Google Analytics client with the same features of Official Google Analytics app in the Android Store.",0
