5972,"This question is not because bizview is my own app the question is for all developers that works hard.",0
5984,"After some diagnosis I found that the issue is caused by the API not handling PDF files encrypted with AES 256 Encryption that the later acrobat versions use.",0
5987,"When drag/dropping files/folders onto Universal Apps the read-only attribute is set making it impossible to edit those files/folders.",0
5990,"After all drag/drop is a conscious user interaction (like a picker) and does not happen without their knowledge.",0
5991,"APIs do not support the configuration of the window background colour.",0
5992,"This means that if like Groove (Music) an app uses a non-white background a noticable section of white appears when a window is dragged to a new size.",0
5995,"The link above is a Sway that explains my suggestion better than i can do so here.",0
5996,"I sincerely hope it makes a difference",0
6009,"Unfortunately neither the SmartCard class nor the SmartCardProvisioning class (nor any other related class) provides a means of retrieving the friendly name later.",0
6021,"Allow third-party Apps to manipulate DOM elements.",1
6037,"It looks as if the return value of...",0
6038,"Windows.System.Power.EnergySaverStatus",0
6041,"Regardless of a threshold set in the energy saver settings.",0
6042,"Looks like a bug.",0
6043,"I'm using a Lumia 620 device with Windows 10 Mobile Build 10586.11.",0
6044,"Could someone please have a look into this",0
6047,"It is frustrated for a devoloper then an app is'nt Show in any category and the app can only find per direct search by Name.",1
6054,"I have released several versions of the app yet I cannot find the number of new users or the number of existing users who have upgraded to the new app version in the DEV center.",0
6055,"I hope I can set my App price is $0.2 but I can't now.",0
6056,"Currently there is no way to schedule recurring notifications using ScheduledToastNotification.",0
6058,"But this is simply not an elegant solution...",0
6067,"All Win32 Mac Linux have API's to do so but UWP doesn't.",0
6069,"When you have a text editor with unsaved changes the standard behavior is to ask the user what to do before closing.",0
6070,"This is not possible on UWP.",0
6074,"Today I have run into a problem with ComboBox control.",0
6075,"The issue can be easily reproduced:",0
6076,"I have two rows and two columns.",0
6077,"Left column takes as much space as possible and I place the ComboBox into the right column.",0
6078,"I populate the ComboBox with a few items and run the app.",0
6079,"I maximize the window open the ComboBox popup (selection menu) minimize and I see the popup moved to the middle of the window.",0
6082,"ShowAt show the flyout with the size (width) defined in the style",0
6083,"However ShowAtAsync show the flyout with the with of the element passed in parameter and ignore the style.",0
6084,"I think its a bug.",0
6087,"I would prefer it return a boolean or an enum with the Fail reason.",1
6088,"Probably when the location is outside the camera frustum...",0
6094,"Currently we have to test if the returned points is inside the rect with a size of map.ActualWidth and map.ActualHeight.",0
6095,"If the point is outside we have to divide the result by RawPixelsPerViewPixel.",0
6097,"a point with a location near the top right corner of the map and inside the map will have an offset of 3190",0
6098,"if the location is slightly on the right the returned point will be 4810 instead of 3210 (you have to divide it by a factor of 1.5 on my Lumia 635).",0
6108,"This can be seen in settings page.",0
6110,"Some apps don't work in background well.",0
6111,"Downloads may breaks when apps switched.",0
6121,"Currently when the publisher name is chosen during signup a publisher id is derived from that.",0
6122,"This publisher id is then used to name the app packages and the apps LocalStorage folder.",0
6123,"If you are careless during signup you are stuck and can't change the publisher id and therefore that naming of your packages.",0
6128,"Super fastest calling with Home Button Shortcut",0
6130," just press key 2 on LOCKED screen for 2 seconds for phone call (profile change etc....run application)",0
6133,"Why can i NOT assign to-run-application for some BUTTON on locked screen...?",0
6134,"Why can i NOT assign to-run-application for some SCREEN-REGION on locked screen...?",0
6146,"Home automation is a huge market for Windows devices.",0
6147,"A big piece of this is being able to monitor/control IP Cameras such as the Foscam HD cameras.",0
6149,"Right now we can only inspect the server certificate after a request was done by using 'RequestMessage.TransportInformation'.",0
6152,"But unfortunately this is application wide and so all certificates of all services of websites that might be called in the app must be included.",0
6153,"Seems like there is a problem with a popup which seems to overlap the application bar.",0
6154,"The strange is that when we open the appbar it seems to be partially covered.",0
6155,"I've observed it on bot - desktop and mobile UWP app.",0
6156,"More description and sample code you can find here: http://stackoverflow.com/q/33321971/2681948",0
6157,"My App has no choice 18+ submit audit report feedback 18+ audit failure",0
6159,"Example An app that allows users to select a time i.e; Tomorrow 1030 AM to do something.",0
6160,"User can also choose to run everyday every week etc.",0
6166,"This feature is available on Android (I heard even on iPhone)",0
6181,"Since the above code does not set a well known header the above code results in an exception: Misused header name.",0
6192,"My company and thousands of others use Sketch to develop app interfaces that we then give to our developers.",0
6195,"There is currently no way how to display in WebView HTTPS web page with invalid certificate even with user specific opt-in.",0
6198,"Currently there is no such provision and all of employees who are coding and publishing apps easily know the revenue earned.",0
6199,"More I earn more chances they will leave and start publishing their own apps.",0
6201,"Both Apple and Google allows us to create user accounts with release manager role who has no access to sales/revenue reports.",0
6202,"In Windows 10 Mobile any third-party app can act as a Caller-ID app to intercept the call and set the PhoneCallOrigin.",0
6203,"But other apps cannot access PhoneCallOrigin from PhoneCallHistoryEntry.",0
6204,"When developing Coded UI test for a localized UWP apps test becomes dependent on texts that are localized.",0
6205,"On most controls this can easily be handled by an AutomationId but on the CoreWindow and MessageBox (incl. buttons) you cannot set any AutomationId’s so the coded UI test has the use the title to find the elements.",0
6208,"I've two apps with same name one is in phone and the other one is in desktop.",0
6209,"Now I created a universal app.",0
6210,"Tab version have a small number of users I need to upload new universal package to the phone version app.",0
6211,"But the problem is the App name automatically reserved to the Tab version and the package name also.",0
6212,"I'm not able to associate the application with the phone build in the store(because the app name is not reserved to this there is no package name or package id for this in the store)",0
6213,"How can I resolve this issue without changing the name of the Phone Build.",0
6228,"See below the template of my button and the two different renderings.",0
6233,"Other strange differences did show up as well - especially in Grids - but the example above is the craziest one.",0
6234,"Please tell me if you want some details about other mismatches.",0
6235,"I've developed application which targets Windows Phone 8.0.",0
6236,"When XAP is deployed on Win10 Mobile device it has some strange bug.",0
6237,"After re-installing the app (uninstall - deploy) Application's Data stays the same - it isn't removed after unstalling the app.",0
6238,"But when I retarget the app to Windows Pone 8.1 problem disappears.",0
6252,"However when the Barcode is generated it will generate this code as image:",0
6258,"I can then enter the encoded image into the above mentioned decoder and it will decode correctly.",0
6272,"I can then enter the encoded image into the above mentioned decoder and it will decode… more",0
6274,"Remote Desktop Services objects for Windows Store apps are no longer available for use as of Windows 10 and Windows Server 2016 Technical Preview.",0
6280,"Negative reviews are bad especially when users rated an old version of the app which will then turn down new users.",0
6289,"Back in Windows Phone 8.0 Silverlight-times I was able to get the content of the CameraRoll much faster (via the MediaLibrary <1 second for the same amount of files).",0
6290,"How can it be that this became so extremely slow with the UAP?",0
6291,"In Silverlight it was once possible to register an app as an option for the edit picker in the photo hub (https://msdn.microsoft.com/en-us/library/windows/apps/jj662932(v=vs.105).aspx).",0
6292,"This is not possbile for UAP apps.",0
6294,"This option is already present in the desktop variant of the app but missing in the mobile app.",0
6299,"The equivalent WinRT API - MessageDialog - provides no apparent means to copy the message to clipboard - no response to right click no response to Ctrl+C.",0
6305,"Thanks for your attention.",0
6309,"I've got a Win8 app in the store.",0
6310,"I want to beta test a win10 version of it.",0
6311,"So I set the app to Hide & Stop selling",0
6312,"I then submit the win10 version and get some promo codes",0
6313,"Watching my app analytics I see *FAR* more devices now have my win10 app than I intended because *updates* still get pushed regardless of the listing settings!",0
6326,"If you are professional developer redesign (your company loves this word) the formal business invoice!",0
6334,"When Microsoft sends a money between the company for your business partner for example outsourced call center do you use credit card for such payment?",0
6340,"It could be something like:",0
6341,"for input nodes",0
6351,"it would be very very appreciated!",0
6357,"I have made an app when I search for it 10 apps pops up and my app isn't any of them.",0
6358,"I just chatted to support they told me that it was because the name was too generic.",0